{
  "schemaVersion": 1,
  "requestDigest": "bbbbbbbbbbbbbbbbbbbbbbbbbbbbbbbbbbbbbbbbbbbbbbbbbbbbbbbbbbbbbbbb",
  "producer": {
    "name": "reference-producer",
    "version": "1.0.0"
  },
  "environment": {
    "node": "26.5.0",
    "pnpm": "10.14.0",
    "python": "3.12.4",
    "uv": "0.11.14",
    "git": "2.48.1",
    "platform": "darwin-arm64",
    "revision": "563c9e479d3a3337d26370821d2c3db667919cc3"
  },
  "immutableInputs": [
    {
      "artifactType": "request-fixture",
      "sha256": "aaaaaaaaaaaaaaaaaaaaaaaaaaaaaaaaaaaaaaaaaaaaaaaaaaaaaaaaaaaaaaaa",
      "byteLength": 128
    }
  ],
  "outputs": [
    {
      "path": "result.txt",
      "byteLength": 6,
      "sha256": "5891b5b522d5df086d0ff0b110fbd9d21bb4fc7163af34d08286a2e846f6be03"
    }
  ],
  "archive": {
    "byteLength": 2048,
    "sha256": "cccccccccccccccccccccccccccccccccccccccccccccccccccccccccccccccc"
  }
}
